{
  "name": "SmbClientSendFile",
  "desc": "The handler that provides the SendFile capability to smbclient.",
  "instrumentType": "controller",
  "capability": "SendFile",
  "providedBy": "Samba",
  "appliesTo": [ "Samba" ],
  "templateFile": "smbsendfile.hbs.sh",
  "subjectIsLocal": false,
  "weight": 90,
  "arguments": {
    "ipv4address": {
      "value": {
        "from": "subject",
        "type": "type.configuration.ipaddress.ipv4address",
	"matches": { "reachable": "true" },
        "strategy": "useFirst",
        "onError": "fail"
      },
      "canBeUserSupplied": false,
      "isOptional": false
    },
    "payloadDirectory": {
      "value": {
        "from": "static",
        "type": "string",
        "strategy": "mustBeOne"
      },
      "canBeUserSupplied": false,
      "isOptional": false
    },
    "payloadFileName": {
      "value": {
        "from": "static",
        "type": "string",
        "strategy": "mustBeOne"
      },
      "canBeUserSupplied": false,
      "isOptional": false
    },
    "username": {
      "value": {
        "from": "static",
        "type": "string",
        "defaultValue": "Administrator",
        "strategy": "mustBeOne"
      },
      "canBeUserSupplied": true,
      "isOptional": true
    },
    "password": {
      "value": {
        "from": "static",
        "type": "string",
        "strategy": "mustBeOne"
      },
      "canBeUserSupplied": true,
      "isOptional": false
    }
  }
}
