{
  "name": "BashInvoke",
  "desc": "BashInvoke",
  "instrumentType": "controller",
  "capability": "Invoke",
  "extension": ".sh",
  "providedBy": "Bash",
  "appliesTo": [ "Bash" ],
  "templateFile": "bashscriptable.hbs.sh",
  "subjectIsLocal": true,
  "arguments": {
    "script": {
      "value": {
	"from": "static",
	"type": "string",
	"strategy": "mustBeOne"
      },
      "canBeUserSupplied": false,
      "isOptional": false
    }
  }
}
