{
  "name": "check",
  "desc": "SystemdCheck",
  "instrumentType": "controller",
  "capability": "State",
  "providedBy": "Systemd",
  "templateFile": "systemdcheck.hbs.sh",
  "appliesTo": [ "Server" ],
  "subjectIsLocal": true,
  "arguments": {
    "origin": {
      "value": {
        "from": "origin",
        "type": "type.component.software.server",
        "strategy": "mustBeOne",
        "onError": "fail"
      },
      "canBeUserSupplied": false,
      "isOptional": false
    }
  }
}
