{
  "name": "stop",
  "desc": "SystemdStop",
  "instrumentType": "controller",
  "capability": "Stop",
  "providedBy": "Systemd",
  "appliesTo": [ "Server" ],
  "templateFile": "systemdstop.hbs.sh",
  "subjectIsLocal": true,
  "arguments": {
    "origin": {
      "value": {
        "from": "origin",
        "type": "type.component.software.server",
        "strategy": "mustBeOne",
        "onError": "fail"
      },
      "canBeUserSupplied": false,
      "isOptional": false
    }
  }
}
